ActivitySourceName,Activity,SectorSourceName,Sector,SectorType,NAPCS_Description,NAICS_2017_Name
NAPCS_2017,5001525000,NAICS_2017_Code,454110,,Retail sales of office equipment and furniture (except computers),Electronic Shopping and Mail-Order Houses
NAPCS_2017,5001550000,NAICS_2017_Code,454110,,"Retail sales of computers and peripheral equipment, communications equipment, and related products",Electronic Shopping and Mail-Order Houses
NAPCS_2017,5001575000,NAICS_2017_Code,443142,,Retail sales of computer software,Electronics Stores
NAPCS_2017,5001625000,NAICS_2017_Code,441228,,"Retail sales of new and used aircraft, engines, and parts and accessories","Motorcycle, ATV, and All Other Motor Vehicle Dealers"
NAPCS_2017,5001650000,NAICS_2017_Code,444210,,"Retail sales of farm machinery, equipment, and parts",Outdoor Power Equipment Stores
NAPCS_2017,5001675000,NAICS_2017_Code,444110,,"Retail sales of power tools and equipment, including portable electric power tools, power air tools, stationary/bench top power tools, and accessories (blades, bits, etc.)",Home Centers
NAPCS_2017,5001700000,NAICS_2017_Code,454110,,Retail sales of exercise/fitness equipment,Electronic Shopping and Mail-Order Houses
NAPCS_2017,5001710000,NAICS_2017_Code,444110,,Retail sales of safes and vaults,Home Centers
NAPCS_2017,5001725000,NAICS_2017_Code,447110,,Retail sales of automotive fuels,Gasoline Stations with Convenience Stores
NAPCS_2017,5001750000,NAICS_2017_Code,454310,,"Retail sales of household fuels, including oil, LP gas, wood, coal",Fuel Dealers
NAPCS_2017,5001775000,NAICS_2017_Code,451130,,"Retail sales of fabrics, yarns, and other sewing materials and supplies","Sewing, Needlework, and Piece Goods Stores"
NAPCS_2017,5001800000,NAICS_2017_Code,444220,,Retail sales of farm and agricultural supplies,"Nursery, Garden Center, and Farm Supply Stores"
NAPCS_2017,5001825000,NAICS_2017_Code,444120,,Retail sales of wallpaper and other flexible wallcoverings,Paint and Wallpaper Stores
NAPCS_2017,5001850000,NAICS_2017_Code,444110,,Retail sales of paint and sundries,Home Centers
NAPCS_2017,5001875000,NAICS_2017_Code,442210,,Retail sales of flooring and floor coverings,Floor Covering Stores
NAPCS_2017,5001900000,NAICS_2017_Code,444110,,"Retail sales of plumbing, electrical, and HVAC supplies",Home Centers
NAPCS_2017,5001925000,NAICS_2017_Code,444190,,"Retail sales of hardware, nonpower hand tools, and other building materials and supplies",Other Building Material Dealers
NAPCS_2017,5001935000,NAICS_2017_Code,454110,,"Retail sales of office and school supplies, packaging and packing materials and supplies, and other general industry and miscellaneous materials and supplies",Electronic Shopping and Mail-Order Houses
NAPCS_2017,5001950000,NAICS_2017_Code,441310,,Retail sales of automotive parts and supplies,Automotive Parts and Accessories Stores
NAPCS_2017,5002000000,NAICS_2017_Code,452311,,"Retail sales of other goods, not elsewhere classified",Warehouse Clubs and Supercenters
