ActivitySourceName,Activity,SectorSourceName,Sector,SectorType,NAPCS_Description,NAICS_2017_Name
NAPCS_2017,4000025000,NAICS_2017_Code,424420,,Wholesale sales of packaged frozen food,Packaged Frozen Food Merchant Wholesalers
NAPCS_2017,4000050000,NAICS_2017_Code,424430,,"Wholesale sales of dairy products, except dried, canned, condensed, and evaporated dairy products",Dairy Product (except Dried or Canned) Merchant Wholesalers
NAPCS_2017,4000075000,NAICS_2017_Code,424440,,"Wholesale sales of eggs and poultry, except canned and frozen poultry products",Poultry and Poultry Product Merchant Wholesalers
NAPCS_2017,4000100000,NAICS_2017_Code,424450,,Wholesale sales of confectionery and snack foods,Confectionery Merchant Wholesalers
NAPCS_2017,4000125000,NAICS_2017_Code,424490,,"Wholesale sales of cookies, bread, and baked goods",Other Grocery and Related Products Merchant Wholesalers
NAPCS_2017,4000150000,NAICS_2017_Code,424460,,"Wholesale sales of fish and seafood, except canned and frozen fish and seafood",Fish and Seafood Merchant Wholesalers
NAPCS_2017,4000175000,NAICS_2017_Code,424470,,"Wholesale sales of fresh meat and meat products, except canned and frozen",Meat and Meat Product Merchant Wholesalers
NAPCS_2017,4000200000,NAICS_2017_Code,424480,,Wholesale sales of fresh fruits and vegetables,Fresh Fruit and Vegetable Merchant Wholesalers
NAPCS_2017,4000225000,NAICS_2017_Code,424490,,Wholesale sales of baking ingredients,Other Grocery and Related Products Merchant Wholesalers
NAPCS_2017,4000230000,NAICS_2017_Code,424990,,"Wholesale sales of soybean, cottonseed, linseed, peanut, sunflower seed, and all other oilseed cake and meal",Other Miscellaneous Nondurable Goods Merchant Wholesalers
NAPCS_2017,4000250000,NAICS_2017_Code,424490,,Wholesale sales of nonperishable (canned and packaged) food,Other Grocery and Related Products Merchant Wholesalers
NAPCS_2017,4000275000,NAICS_2017_Code,424490,,Wholesale sales of grocery specialties,Other Grocery and Related Products Merchant Wholesalers
NAPCS_2017,4000300000,NAICS_2017_Code,424490,,"Wholesale sales of coffee, tea, and powdered drink mixes",Other Grocery and Related Products Merchant Wholesalers
NAPCS_2017,4000325000,NAICS_2017_Code,424490,,"Wholesale sales of food and beverage basic materials, including flavoring extracts, fruit peel, sausage casings, hop extract, malt, and yeast",Other Grocery and Related Products Merchant Wholesalers
NAPCS_2017,4000350000,NAICS_2017_Code,424490,,"Wholesale sales of soft drinks, bottled water, juices, and nonalcoholic beverages",Other Grocery and Related Products Merchant Wholesalers
NAPCS_2017,4000375000,NAICS_2017_Code,424810,,Wholesale sales of beer and ale,Beer and Ale Merchant Wholesalers
NAPCS_2017,4000400000,NAICS_2017_Code,424820,,"Wholesale sales of wine and distilled liquor, including premixed alcoholic drinks",Wine and Distilled Alcoholic Beverage Merchant Wholesalers
NAPCS_2017,4000425000,NAICS_2017_Code,424990,,Wholesale sales of ice,Other Miscellaneous Nondurable Goods Merchant Wholesalers
NAPCS_2017,4000450000,NAICS_2017_Code,424940,,Wholesale sales of tobacco products and electronic cigarettes,Tobacco and Tobacco Product Merchant Wholesalers
NAPCS_2017,4000475000,NAICS_2017_Code,424990,,Wholesale sales of smoking accessories,Other Miscellaneous Nondurable Goods Merchant Wholesalers
NAPCS_2017,4000500000,NAICS_2017_Code,424320,,Wholesale sales of men's and boys' clothing,Men's and Boys' Clothing and Furnishings Merchant Wholesalers
NAPCS_2017,4000525000,NAICS_2017_Code,424330,,"Wholesale sales of women's, misses', and girls' clothing ","Women's, Children's, and Infants' Clothing and Accessories Merchant Wholesalers"
NAPCS_2017,4000550000,NAICS_2017_Code,424330,,"Wholesale sales of infants' and children's clothing, to size 6X, including accessories","Women's, Children's, and Infants' Clothing and Accessories Merchant Wholesalers"
NAPCS_2017,4000575000,NAICS_2017_Code,423910,,Wholesale sales of athletic uniforms,Sporting and Recreational Goods and Supplies Merchant Wholesalers
NAPCS_2017,4000600000,NAICS_2017_Code,424340,,Wholesale sales of footwear and footwear accessories,Footwear Merchant Wholesalers
NAPCS_2017,4000625000,NAICS_2017_Code,424330,,Wholesale sales of clothing accessories,"Women's, Children's, and Infants' Clothing and Accessories Merchant Wholesalers"
NAPCS_2017,4000650000,NAICS_2017_Code,423940,,Wholesale sales of costume jewelry,"Jewelry, Watch, Precious Stone, and Precious Metal Merchant Wholesalers"
NAPCS_2017,4000675000,NAICS_2017_Code,423940,,"Wholesale sales of jewelry, except costume","Jewelry, Watch, Precious Stone, and Precious Metal Merchant Wholesalers"
NAPCS_2017,4000700000,NAICS_2017_Code,423940,,Wholesale sales of watches and watch parts,"Jewelry, Watch, Precious Stone, and Precious Metal Merchant Wholesalers"
NAPCS_2017,4000725000,NAICS_2017_Code,453930,,Wholesale sales of manufactured (mobile) homes,Manufactured (Mobile) Home Dealers
NAPCS_2017,4000750000,NAICS_2017_Code,423210,,Wholesale sales of household and lawn furniture,Furniture Merchant Wholesalers
NAPCS_2017,4000775000,NAICS_2017_Code,423220,,Wholesale sales of window treatments,Home Furnishing Merchant Wholesalers
NAPCS_2017,4000800000,NAICS_2017_Code,423220,,"Wholesale sales of other textile house furnishings, except floor coverings",Home Furnishing Merchant Wholesalers
NAPCS_2017,4000825000,NAICS_2017_Code,424930,,"Wholesale sales of artificial flowers, plants, and trees","Flower, Nursery Stock, and Florists' Supplies Merchant Wholesalers"
NAPCS_2017,4000850000,NAICS_2017_Code,423220,,"Wholesale sales of household furnishings, except artificial flowers, plants, and trees",Home Furnishing Merchant Wholesalers
NAPCS_2017,4000860000,NAICS_2017_Code,423940,,"Wholesale sales of clocks, trophies, and works of art","Jewelry, Watch, Precious Stone, and Precious Metal Merchant Wholesalers"
NAPCS_2017,4000870000,NAICS_2017_Code,424990,,Wholesale sales of canvas awnings,Other Miscellaneous Nondurable Goods Merchant Wholesalers
NAPCS_2017,4000875000,NAICS_2017_Code,423620,,"Wholesale sales of household appliances, including personal care appliances","Household Appliances, Electric Housewares, and Consumer Electronics Merchant Wholesalers"
NAPCS_2017,4000900000,NAICS_2017_Code,423220,,"Wholesale sales of tableware, kitchenware, cookware, and glassware, except cutlery and novelty glassware",Home Furnishing Merchant Wholesalers
NAPCS_2017,4000925000,NAICS_2017_Code,423220,,"Wholesale sales of cutlery, except disposable plastics",Home Furnishing Merchant Wholesalers
NAPCS_2017,4000950000,NAICS_2017_Code,423220,,Wholesale sales of novelty glassware,Home Furnishing Merchant Wholesalers
NAPCS_2017,4000960000,NAICS_2017_Code,423620,,"Wholesale sales of outdoor grills, gas and charcoal","Household Appliances, Electric Housewares, and Consumer Electronics Merchant Wholesalers"
NAPCS_2017,4000975000,NAICS_2017_Code,423820,,"Wholesale sales of home lawn and garden equipment, tools, and supplies, except fresh flowers, florists' supplies, live trees, plants, and nursery stock",Farm and Garden Machinery and Equipment Merchant Wholesalers
NAPCS_2017,4000985000,NAICS_2017_Code,425120,,Wholesale sales of swimming pools and swimming pool supplies,Wholesale Trade Agents and Brokers
NAPCS_2017,4001000000,NAICS_2017_Code,424930,,"Wholesale sales of fresh flowers, florists' supplies, live trees, plants, and nursery stock","Flower, Nursery Stock, and Florists' Supplies Merchant Wholesalers"
NAPCS_2017,4001025000,NAICS_2017_Code,424130,,"Wholesale sales of household paper and plastic products, not elsewhere classified",Industrial and Personal Service Paper Merchant Wholesalers
NAPCS_2017,4001050000,NAICS_2017_Code,423620,,"Wholesale sales of televisions, home audio and visual equipment","Household Appliances, Electric Housewares, and Consumer Electronics Merchant Wholesalers"
NAPCS_2017,4001075000,NAICS_2017_Code,423410,,"Wholesale sales of still picture photographic equipment, digital and film cameras, household type",Photographic Equipment and Supplies Merchant Wholesalers
NAPCS_2017,4001100000,NAICS_2017_Code,423990,,Wholesale sales of audio and video recordings,Other Miscellaneous Durable Goods Merchant Wholesalers
NAPCS_2017,4001125000,NAICS_2017_Code,424120,,Wholesale sales of greeting cards,Stationery and Office Supplies Merchant Wholesalers
NAPCS_2017,4001150000,NAICS_2017_Code,424920,,"Wholesale sales of newspapers, periodicals, books and other publications, except greeting cards","Book, Periodical, and Newspaper Merchant Wholesalers"
NAPCS_2017,4001175000,NAICS_2017_Code,423910,,Wholesale sales of sporting and recreational equipment,Sporting and Recreational Goods and Supplies Merchant Wholesalers
NAPCS_2017,4001200000,NAICS_2017_Code,423920,,"Wholesale sales of toys, games, and hobby goods",Toy and Hobby Goods and Supplies Merchant Wholesalers
NAPCS_2017,4001225000,NAICS_2017_Code,423910,,Wholesale sales of boats and go-carts,Sporting and Recreational Goods and Supplies Merchant Wholesalers
NAPCS_2017,4001250000,NAICS_2017_Code,423110,,Wholesale sales of motorcycles and other sports vehicles,Automobile and Other Motor Vehicle Merchant Wholesalers
NAPCS_2017,4001275000,NAICS_2017_Code,423990,,Wholesale sales of musical instruments,Other Miscellaneous Durable Goods Merchant Wholesalers
NAPCS_2017,4001300000,NAICS_2017_Code,423990,,"Wholesale sales of household pets, pet foods, and pet supplies",Other Miscellaneous Durable Goods Merchant Wholesalers
NAPCS_2017,4001325000,NAICS_2017_Code,423110,,Wholesale sales of new and used automobiles ,Automobile and Other Motor Vehicle Merchant Wholesalers
NAPCS_2017,4001350000,NAICS_2017_Code,423110,,"Wholesale sales of new and used light trucks, 14,000 lb. or less, including vans, cargo vans, and SUVs ",Automobile and Other Motor Vehicle Merchant Wholesalers
NAPCS_2017,4001375000,NAICS_2017_Code,423110,,"Wholesale sales of motor homes, travel trailers, and campers",Automobile and Other Motor Vehicle Merchant Wholesalers
NAPCS_2017,4001400000,NAICS_2017_Code,423990,,"Wholesale sales of luggage, including backpacks",Other Miscellaneous Durable Goods Merchant Wholesalers
NAPCS_2017,4001425000,NAICS_2017_Code,425120,,Wholesale sales of prescription drugs and antibiotics,Wholesale Trade Agents and Brokers
NAPCS_2017,4001450000,NAICS_2017_Code,425120,,Wholesale sales of nonprescription drugs and over-the-counter medications,Wholesale Trade Agents and Brokers
NAPCS_2017,4001475000,NAICS_2017_Code,424210,,Wholesale sales of vitamins and nutritional and herbal supplements,Drugs and Druggists' Sundries Merchant Wholesalers
NAPCS_2017,4001500000,NAICS_2017_Code,423460,,Wholesale sales of optical and ophthalmic goods and supplies,Ophthalmic Goods Merchant Wholesalers
NAPCS_2017,4001525000,NAICS_2017_Code,423450,,"Wholesale sales of orthopedic and prosthetic appliances and supplies, including wheelchairs, walkers, crutches, canes, and hearing aids","Medical, Dental, and Hospital Equipment and Supplies Merchant Wholesalers"
NAPCS_2017,4001550000,NAICS_2017_Code,424210,,Wholesale sales of health aids and first aid supplies,Drugs and Druggists' Sundries Merchant Wholesalers
NAPCS_2017,4001575000,NAICS_2017_Code,424210,,"Wholesale sales of cosmetics, beauty supplies, perfumes and colognes, including hair preparations and hair brushes ",Drugs and Druggists' Sundries Merchant Wholesalers
NAPCS_2017,4001600000,NAICS_2017_Code,424210,,"Wholesale sales of bath, facial, and hand soaps",Drugs and Druggists' Sundries Merchant Wholesalers
NAPCS_2017,4001625000,NAICS_2017_Code,424130,,"Wholesale sales of personal care paper products, including disposable diapers, feminine hygiene products, and similar",Industrial and Personal Service Paper Merchant Wholesalers
NAPCS_2017,4001650000,NAICS_2017_Code,425120,,"Wholesale sales of other personal care supplies, including toothbrushes (except electric), razor blades, and razors (except electric)",Wholesale Trade Agents and Brokers
NAPCS_2017,4001675000,NAICS_2017_Code,423850,,Wholesale sales of caskets and other funeral goods,Service Establishment Equipment and Supplies Merchant Wholesalers
NAPCS_2017,4001700000,NAICS_2017_Code,423610,,"Wholesale sales of batteries, except automotive","Electrical Apparatus and Equipment, Wiring Supplies, and Related Equipment Merchant Wholesalers"
NAPCS_2017,4001725000,NAICS_2017_Code,423490,,Wholesale sales of religious supplies,Other Professional Equipment and Supplies Merchant Wholesalers
NAPCS_2017,4001750000,NAICS_2017_Code,424990,,"Wholesale sales of novelties and souvenirs, except novelty glassware",Other Miscellaneous Nondurable Goods Merchant Wholesalers
NAPCS_2017,4001775000,NAICS_2017_Code,424330,,Wholesale sales of infants' goods and accessories,"Women's, Children's, and Infants' Clothing and Accessories Merchant Wholesalers"
NAPCS_2017,4001785000,NAICS_2017_Code,424990,,Wholesale sales of gift cards,Other Miscellaneous Nondurable Goods Merchant Wholesalers
NAPCS_2017,4001800000,NAICS_2017_Code,423420,,"Wholesale sales of office equipment, except computers",Office Equipment Merchant Wholesalers
NAPCS_2017,4001825000,NAICS_2017_Code,423210,,Wholesale sales of office furniture,Furniture Merchant Wholesalers
NAPCS_2017,4001850000,NAICS_2017_Code,423430,,"Wholesale sales of computers and peripheral equipment, except computer components",Computer and Computer Peripheral Equipment and Software Merchant Wholesalers
NAPCS_2017,4001875000,NAICS_2017_Code,423690,,Wholesale sales of communications equipment,Other Electronic Parts and Equipment Merchant Wholesalers
NAPCS_2017,4001900000,NAICS_2017_Code,423430,,Wholesale sales of computer software,Computer and Computer Peripheral Equipment and Software Merchant Wholesalers
NAPCS_2017,4001925000,NAICS_2017_Code,423110,,Wholesale sales of buses,Automobile and Other Motor Vehicle Merchant Wholesalers
NAPCS_2017,4001950000,NAICS_2017_Code,423110,,"Wholesale sales of medium trucks and tractors, 14,001 lb. to 33,000 lb.",Automobile and Other Motor Vehicle Merchant Wholesalers
NAPCS_2017,4001975000,NAICS_2017_Code,423110,,"Wholesale sales of heavy trucks, trailers, and road tractors, more than 33,000 lb.",Automobile and Other Motor Vehicle Merchant Wholesalers
NAPCS_2017,4002000000,NAICS_2017_Code,423860,,Wholesale sales of aircraft and aeronautical equipment,Transportation Equipment and Supplies (except Motor Vehicle) Merchant Wholesalers
NAPCS_2017,4002025000,NAICS_2017_Code,423860,,Wholesale sales of marine machinery and equipment,Transportation Equipment and Supplies (except Motor Vehicle) Merchant Wholesalers
NAPCS_2017,4002050000,NAICS_2017_Code,423860,,Wholesale sales of other transportation equipment ,Transportation Equipment and Supplies (except Motor Vehicle) Merchant Wholesalers
NAPCS_2017,4002075000,NAICS_2017_Code,423820,,Wholesale sales of farm machinery and equipment,Farm and Garden Machinery and Equipment Merchant Wholesalers
NAPCS_2017,4002100000,NAICS_2017_Code,423810,,"Wholesale sales of construction, forestry, and mining machinery and equipment, including attachments",Construction and Mining (except Oil Well) Machinery and Equipment Merchant Wholesalers
NAPCS_2017,4002125000,NAICS_2017_Code,423830,,Wholesale sales of oil well and pipeline machinery and equipment,Industrial Machinery and Equipment Merchant Wholesalers
NAPCS_2017,4002150000,NAICS_2017_Code,423830,,Wholesale sales of new woodworking machinery,Industrial Machinery and Equipment Merchant Wholesalers
NAPCS_2017,4002175000,NAICS_2017_Code,423830,,Wholesale sales of new printing trades machinery and equipment,Industrial Machinery and Equipment Merchant Wholesalers
NAPCS_2017,4002200000,NAICS_2017_Code,423830,,Wholesale sales of new food-processing machinery and equipment,Industrial Machinery and Equipment Merchant Wholesalers
NAPCS_2017,4002225000,NAICS_2017_Code,423830,,Wholesale sales of new metal smelting and refining machinery and equipment,Industrial Machinery and Equipment Merchant Wholesalers
NAPCS_2017,4002250000,NAICS_2017_Code,423830,,Wholesale sales of new oil refinery machinery and equipment,Industrial Machinery and Equipment Merchant Wholesalers
NAPCS_2017,4002275000,NAICS_2017_Code,423830,,Wholesale sales of new textile and sewing machinery and equipment,Industrial Machinery and Equipment Merchant Wholesalers
NAPCS_2017,4002300000,NAICS_2017_Code,423830,,"Wholesale sales of specialized industrial machinery and equipment, including welding, not elsewhere classified",Industrial Machinery and Equipment Merchant Wholesalers
NAPCS_2017,4002325000,NAICS_2017_Code,423830,,"Wholesale sales of metalworking machinery and equipment, except welding equipment",Industrial Machinery and Equipment Merchant Wholesalers
NAPCS_2017,4002350000,NAICS_2017_Code,423710,,"Wholesale sales of hand tools, power driven ",Hardware Merchant Wholesalers
NAPCS_2017,4002375000,NAICS_2017_Code,423830,,Wholesale sales of new materials handling machinery and equipment,Industrial Machinery and Equipment Merchant Wholesalers
NAPCS_2017,4002400000,NAICS_2017_Code,423610,,"Wholesale sales of electricity generation, control, and storage equipment","Electrical Apparatus and Equipment, Wiring Supplies, and Related Equipment Merchant Wholesalers"
NAPCS_2017,4002425000,NAICS_2017_Code,423830,,"Wholesale sales of new industrial machinery and equipment, not elsewhere classified, including storage tanks, pumps and scales",Industrial Machinery and Equipment Merchant Wholesalers
NAPCS_2017,4002450000,NAICS_2017_Code,423830,,Wholesale sales of used industrial machinery and equipment,Industrial Machinery and Equipment Merchant Wholesalers
NAPCS_2017,4002475000,NAICS_2017_Code,423490,,Wholesale sales of navigational and measuring equipment,Other Professional Equipment and Supplies Merchant Wholesalers
NAPCS_2017,4002485000,NAICS_2017_Code,423830,,"Wholesale sales of new controlling, recording, and indicating instruments and accessories",Industrial Machinery and Equipment Merchant Wholesalers
NAPCS_2017,4002500000,NAICS_2017_Code,423740,,Wholesale sales of refrigeration equipment,Refrigeration Equipment and Supplies Merchant Wholesalers
NAPCS_2017,4002525000,NAICS_2017_Code,423450,,"Wholesale sales of medical, dental, and veterinary equipment","Medical, Dental, and Hospital Equipment and Supplies Merchant Wholesalers"
NAPCS_2017,4002550000,NAICS_2017_Code,423210,,Wholesale sales of commercial furniture,Furniture Merchant Wholesalers
NAPCS_2017,4002560000,NAICS_2017_Code,425120,,"Wholesale sales of restaurant, commercial food service and hotel equipment ",Wholesale Trade Agents and Brokers
NAPCS_2017,4002575000,NAICS_2017_Code,423440,,Wholesale sales of store equipment,Other Commercial Equipment Merchant Wholesalers
NAPCS_2017,4002600000,NAICS_2017_Code,423850,,Wholesale sales of commercial and service industry equipment,Service Establishment Equipment and Supplies Merchant Wholesalers
NAPCS_2017,4002625000,NAICS_2017_Code,423410,,Wholesale sales of commercial photography and motion picture equipment,Photographic Equipment and Supplies Merchant Wholesalers
NAPCS_2017,4002650000,NAICS_2017_Code,423440,,Wholesale sales of nonelectric signs and coin-operated games,Other Commercial Equipment Merchant Wholesalers
NAPCS_2017,4002675000,NAICS_2017_Code,423120,,Wholesale sales of petroleum products marketing equipment,Motor Vehicle Supplies and New Parts Merchant Wholesalers
NAPCS_2017,4002700000,NAICS_2017_Code,423910,,Wholesale sales of exercise/fitness equipment,Sporting and Recreational Goods and Supplies Merchant Wholesalers
NAPCS_2017,4002725000,NAICS_2017_Code,425120,,Wholesale sales of binoculars,Wholesale Trade Agents and Brokers
NAPCS_2017,4002750000,NAICS_2017_Code,423830,,Wholesale sales of industrial water treatment equipment,Industrial Machinery and Equipment Merchant Wholesalers
NAPCS_2017,4002775000,NAICS_2017_Code,424710,,"Wholesale sales of refined petroleum products, except liquefied petroleum (LP)",Petroleum Bulk Stations and Terminals
NAPCS_2017,4002780000,NAICS_2017_Code,423420,,Wholesale sales of safes and vaults,Office Equipment Merchant Wholesalers
NAPCS_2017,4002800000,NAICS_2017_Code,423520,,Wholesale sales of coal,Coal and Other Mineral and Ore Merchant Wholesalers
NAPCS_2017,4002825000,NAICS_2017_Code,423990,,Wholesale sales of cordwood and firewood,Other Miscellaneous Durable Goods Merchant Wholesalers
NAPCS_2017,4002830000,NAICS_2017_Code,424990,,Wholesale sales of charcoal,Other Miscellaneous Nondurable Goods Merchant Wholesalers
NAPCS_2017,4002850000,NAICS_2017_Code,424720,,"Wholesale sales of other fuels, not elsewhere classified",Petroleum and Petroleum Products Merchant Wholesalers (except Bulk Stations and Terminals)
NAPCS_2017,4002875000,NAICS_2017_Code,425120,,"Wholesale sales of grains, beans, and seeds",Wholesale Trade Agents and Brokers
NAPCS_2017,4002925000,NAICS_2017_Code,424430,,Wholesale sales of raw milk and cream,Dairy Product (except Dried or Canned) Merchant Wholesalers
NAPCS_2017,4002950000,NAICS_2017_Code,424810,,Wholesale sales of brewers' products,Beer and Ale Merchant Wholesalers
NAPCS_2017,4002970000,NAICS_2017_Code,425120,,"Wholesale sales of inedible animal or vegetable greases and oil, including linseed and cottonseed oil",Wholesale Trade Agents and Brokers
NAPCS_2017,4002975000,NAICS_2017_Code,424590,,Wholesale sales of raw sugar and other raw farm products used in food production,Other Farm Product Raw Material Merchant Wholesalers
NAPCS_2017,4003000000,NAICS_2017_Code,424440,,Wholesale sales of live poultry,Poultry and Poultry Product Merchant Wholesalers
NAPCS_2017,4003025000,NAICS_2017_Code,425120,,Wholesale sales of livestock,Wholesale Trade Agents and Brokers
NAPCS_2017,4003050000,NAICS_2017_Code,424590,,Wholesale sales of materials and supplies for tobacco manufacturing,Other Farm Product Raw Material Merchant Wholesalers
NAPCS_2017,4003075000,NAICS_2017_Code,424990,,Wholesale sales of yarns,Other Miscellaneous Nondurable Goods Merchant Wholesalers
NAPCS_2017,4003100000,NAICS_2017_Code,423930,,"Wholesale sales of recyclable textiles, including rags and textile scraps",Recyclable Material Merchant Wholesalers
NAPCS_2017,4003125000,NAICS_2017_Code,424590,,Wholesale sales of other materials and supplies for textile mills,Other Farm Product Raw Material Merchant Wholesalers
NAPCS_2017,4003150000,NAICS_2017_Code,424310,,Wholesale sales of knit and woven piece goods,"Piece Goods, Notions, and Other Dry Goods Merchant Wholesalers"
NAPCS_2017,4003175000,NAICS_2017_Code,424310,,"Wholesale sales of notions, including buttons, ribbons, lace, sewing accessories, zippers, and bindings","Piece Goods, Notions, and Other Dry Goods Merchant Wholesalers"
NAPCS_2017,4003200000,NAICS_2017_Code,424590,,"Wholesale sales of hides, skins, and pelts",Other Farm Product Raw Material Merchant Wholesalers
NAPCS_2017,4003210000,NAICS_2017_Code,423940,,Wholesale sales of leather cut stock for shoes and boots,"Jewelry, Watch, Precious Stone, and Precious Metal Merchant Wholesalers"
NAPCS_2017,4003225000,NAICS_2017_Code,423990,,Wholesale sales of pulpwood,Other Miscellaneous Durable Goods Merchant Wholesalers
NAPCS_2017,4003250000,NAICS_2017_Code,424990,,Wholesale sales of wood pulp,Other Miscellaneous Nondurable Goods Merchant Wholesalers
NAPCS_2017,4003275000,NAICS_2017_Code,423930,,Wholesale sales of recyclable paper and paperboard,Recyclable Material Merchant Wholesalers
NAPCS_2017,4003300000,NAICS_2017_Code,424110,,Wholesale sales of printing paper,Printing and Writing Paper Merchant Wholesalers
NAPCS_2017,4003310000,NAICS_2017_Code,423830,,"Wholesale sales of ink and printing trades supplies, except paper",Industrial Machinery and Equipment Merchant Wholesalers
NAPCS_2017,4003325000,NAICS_2017_Code,424720,,Wholesale sales of crude oil,Petroleum and Petroleum Products Merchant Wholesalers (except Bulk Stations and Terminals)
NAPCS_2017,4003350000,NAICS_2017_Code,424720,,"Wholesale sales of other petroleum products, including asphalt, road oil, and wax",Petroleum and Petroleum Products Merchant Wholesalers (except Bulk Stations and Terminals)
NAPCS_2017,4003375000,NAICS_2017_Code,424690,,"Wholesale sales of chemicals, except explosives and automotive, drillers, and sanitation chemicals",Other Chemical and Allied Products Merchant Wholesalers
NAPCS_2017,4003400000,NAICS_2017_Code,424720,,Wholesale sales of liquefied petroleum (LP),Petroleum and Petroleum Products Merchant Wholesalers (except Bulk Stations and Terminals)
NAPCS_2017,4003425000,NAICS_2017_Code,424690,,"Wholesale sales of industrial gases, except oxygen, acetylene and other welding gases",Other Chemical and Allied Products Merchant Wholesalers
NAPCS_2017,4003450000,NAICS_2017_Code,424690,,Wholesale sales of acetylene and other welding gases,Other Chemical and Allied Products Merchant Wholesalers
NAPCS_2017,4003475000,NAICS_2017_Code,424690,,Wholesale sales of oxygen,Other Chemical and Allied Products Merchant Wholesalers
NAPCS_2017,4003500000,NAICS_2017_Code,424610,,"Wholesale sales of laminates, plastic raw materials, and crude rubber",Plastics Materials and Basic Forms and Shapes Merchant Wholesalers
NAPCS_2017,4003510000,NAICS_2017_Code,424690,,Wholesale sales of synthetic resins,Other Chemical and Allied Products Merchant Wholesalers
NAPCS_2017,4003520000,NAICS_2017_Code,425120,,Wholesale sales of recyclable plastics and rubber,Wholesale Trade Agents and Brokers
NAPCS_2017,4003525000,NAICS_2017_Code,423520,,"Wholesale sales of nonmetallic minerals, except crude petroleum and minerals used in construction and fertilizer",Coal and Other Mineral and Ore Merchant Wholesalers
NAPCS_2017,4003550000,NAICS_2017_Code,423930,,Wholesale sales of materials and supplies for glass products manufacturing,Recyclable Material Merchant Wholesalers
NAPCS_2017,4003575000,NAICS_2017_Code,423520,,"Wholesale sales of ores, except coal, gemstones, and crude oil",Coal and Other Mineral and Ore Merchant Wholesalers
